{
  "$id": "document.schema.json",
  "title": "UniverseEntity — document",
  "$schema": "https://json-schema.org/draft/2020-12/schema",
  "type": "object",
  "properties": {
    "id": {
      "type": "string",
      "minLength": 1,
      "pattern": "^[a-z0-9-]+\\.[a-z0-9-]+$"
    },
    "type": {
      "type": "string",
      "const": "document"
    },
    "slug": {
      "type": "string",
      "minLength": 1,
      "pattern": "^[a-z0-9]+(?:-[a-z0-9]+)*$"
    },
    "name": {
      "type": "object",
      "properties": {
        "ru": {
          "type": "string",
          "minLength": 1
        },
        "en": {
          "type": "string",
          "minLength": 1
        }
      },
      "required": [
        "ru",
        "en"
      ],
      "additionalProperties": false
    },
    "shortDescription": {
      "type": "object",
      "properties": {
        "ru": {
          "type": "string",
          "minLength": 1
        },
        "en": {
          "type": "string",
          "minLength": 1
        }
      },
      "required": [
        "ru",
        "en"
      ],
      "additionalProperties": false
    },
    "description": {
      "type": "object",
      "properties": {
        "ru": {
          "type": "string",
          "minLength": 1
        },
        "en": {
          "type": "string",
          "minLength": 1
        }
      },
      "required": [
        "ru",
        "en"
      ],
      "additionalProperties": false
    },
    "media": {
      "type": "array",
      "items": {
        "type": "object",
        "properties": {
          "id": {
            "type": "string",
            "minLength": 1
          },
          "role": {
            "type": "string",
            "enum": [
              "portrait",
              "hero",
              "gallery",
              "diagram",
              "living-preview",
              "thumbnail"
            ]
          },
          "alt": {
            "type": "object",
            "properties": {
              "ru": {
                "type": "string",
                "minLength": 1
              },
              "en": {
                "type": "string",
                "minLength": 1
              }
            },
            "required": [
              "ru",
              "en"
            ],
            "additionalProperties": false
          },
          "caption": {
            "type": "object",
            "properties": {
              "ru": {
                "type": "string",
                "minLength": 1
              },
              "en": {
                "type": "string",
                "minLength": 1
              }
            },
            "required": [
              "ru",
              "en"
            ],
            "additionalProperties": false
          }
        },
        "required": [
          "id"
        ],
        "additionalProperties": false
      }
    },
    "relations": {
      "type": "array",
      "items": {
        "type": "object",
        "properties": {
          "type": {
            "type": "string",
            "minLength": 1
          },
          "target": {
            "type": "string",
            "minLength": 1
          }
        },
        "required": [
          "type",
          "target"
        ],
        "additionalProperties": false
      }
    },
    "clearance": {
      "type": "string",
      "enum": [
        "guest",
        "civilian",
        "authorized",
        "restricted",
        "classified"
      ]
    },
    "tags": {
      "type": "array",
      "items": {
        "type": "string",
        "minLength": 1
      }
    }
  },
  "required": [
    "id",
    "type",
    "slug",
    "name"
  ],
  "additionalProperties": false
}
